<?xml version="1.0" encoding="UTF-8"?>
<!--
    Ejercicio de la materia "Laboratorio de Programación" de la carrera Licenciatura en Sistemas,
    Universidad Nacional de la Patagonia Austral (UNPA).

    Archivo XML de playlists musicales.
    Realizado como parte del trabajo práctico n°2 ejercicio 02",

    Autor: Nicolás Butterfield
    Año: 2025
-->
<playlists xmlns:xsi="http://www.w3.org/2001/XMLSchema-instance" xsi:noNamespaceSchemaLocation="BUTTERFIELD_TP02_E02_PLAYLIST.xsd">
    <playlist>
        <id>1</id>
        <titulo>Rock Nacional</titulo>
        <interprete>Charly García</interprete>
        <cantidad_temas>10</cantidad_temas>
        <duracion_total>42.50</duracion_total>
        <generos>
            <genero_id>101</genero_id>
            <genero_id>102</genero_id>
        </generos>
    </playlist>
    <playlist>
        <id>2</id>
        <titulo>Pop Latino</titulo>
        <interprete>Shakira</interprete>
        <cantidad_temas>8</cantidad_temas>
        <duracion_total>30.75</duracion_total>
        <generos>
            <genero_id>103</genero_id>
        </generos>
    </playlist>
</playlists>